ID,Name,Year,Runtime,User Rating,Metascore,Director,Actors,Genre
0727,Mars Attacks!,1996,106 min,6.3,52,Tim Burton,"Jack Nicholson, Pierce Brosnan, Sarah Jessica Parker, Annette Bening","Comedy, Sci-Fi"
0728,American Reunion,2012,113 min,6.7,49,Jon Hurwitz,"Hayden Schlossberg, Jason Biggs, Alyson Hannigan, Seann William Scott, Chris Klein",Comedy
0729,Chicago,2002,113 min,7.2,82,Rob Marshall,"Renée Zellweger, Catherine Zeta-Jones, Richard Gere, Taye Diggs","Comedy, Crime, Musical"
0730,Cowboys & Aliens,2011,119 min,6,50,Jon Favreau,"Daniel Craig, Harrison Ford, Olivia Wilde, Abigail Spencer","Action, Sci-Fi, Thriller"
0731,My Neighbor Totoro,1988,86 min,8.2,86,Hayao Miyazaki,"Hitoshi Takagi, Noriko Hidaka, Chika Sakamoto, Shigesato Itoi","Animation, Family, Fantasy"
0732,What's Eating Gilbert Grape,1993,118 min,7.8,73,Lasse Hallström,"Johnny Depp, Leonardo DiCaprio, Juliette Lewis, Mary Steenburgen",Drama
0733,Gandhi,1982,191 min,8.1,79,Richard Attenborough,"Ben Kingsley, John Gielgud, Rohini Hattangadi, Roshan Seth","Biography, Drama, History"
0734,Bridget Jones's Diary,2001,97 min,6.7,66,Sharon Maguire,"Renée Zellweger, Colin Firth, Hugh Grant, Gemma Jones","Comedy, Drama, Romance"
0735,Mulan,1998,88 min,7.6,71,Tony Bancroft,"Barry Cook, Ming-Na Wen, Eddie Murphy, BD Wong, Miguel Ferrer","Animation, Adventure, Family"
0736,Predators,2010,107 min,6.4,51,Nimród Antal,"Adrien Brody, Laurence Fishburne, Topher Grace, Alice Braga","Action, Adventure, Sci-Fi"
0737,The Girl Next Door,2004,109 min,6.7,47,Luke Greenfield,"Emile Hirsch, Nicholas Downs, Elisha Cuthbert, Timothy Olyphant","Comedy, Drama, Romance"
0738,Anger Management,2003,106 min,6.2,52,Peter Segal,"Jack Nicholson, Adam Sandler, Marisa Tomei, Luis Guzmán",Comedy
0739,Traffic,2000,147 min,7.6,86,Steven Soderbergh,"Michael Douglas, Benicio Del Toro, Catherine Zeta-Jones, Jacob Vargas","Crime, Drama, Thriller"
0740,Alien: Resurrection,1997,109 min,6.2,63,Jean-Pierre Jeunet,"Sigourney Weaver, Winona Ryder, Dominique Pinon, Ron Perlman","Action, Horror, Sci-Fi"
0741,Die Another Day,2002,133 min,6.1,56,Lee Tamahori,"Pierce Brosnan, Halle Berry, Rosamund Pike, Toby Stephens","Action, Adventure, Thriller"
0742,The Little Mermaid,1989,83 min,7.6,88,Ron Clements,"John Musker, Jodi Benson, Samuel E. Wright, Rene Auberjonois, Christopher Daniel Barnes","Animation, Family, Fantasy"
0743,Grease,1978,110 min,7.2,70,Randal Kleiser,"John Travolta, Olivia Newton-John, Stockard Channing, Jeff Conaway","Musical, Romance"
0744,The Hunt,2012,115 min,8.3,77,Thomas Vinterberg,"Mads Mikkelsen, Thomas Bo Larsen, Annika Wedderkopp, Lasse Fogelstrøm",Drama
0745,Meet Joe Black,1998,178 min,7.2,43,Martin Brest,"Brad Pitt, Anthony Hopkins, Claire Forlani, Jake Weber","Drama, Fantasy, Romance"
0746,No Strings Attached,2011,108 min,6.2,50,Ivan Reitman,"Natalie Portman, Ashton Kutcher, Kevin Kline, Cary Elwes","Comedy, Romance"
0747,Closer,2004,104 min,7.3,65,Mike Nichols,"Natalie Portman, Jude Law, Clive Owen, Julia Roberts","Drama, Romance"
0748,Before Sunset,2004,80 min,8.1,90,Richard Linklater,"Ethan Hawke, Julie Delpy, Vernon Dobtcheff, Louise Lemoine Torrès","Drama, Romance"
0749,Master and Commander: The Far Side of the World,2003,138 min,7.4,81,Peter Weir,"Russell Crowe, Paul Bettany, Billy Boyd, James D'Arcy","Action, Adventure, Drama"
0750,Get Smart,2008,110 min,6.5,54,Peter Segal,"Steve Carell, Anne Hathaway, Alan Arkin, Dwayne Johnson","Action, Adventure, Comedy"
0751,Das Boot,1981,149 min,8.4,86,Wolfgang Petersen,"Jürgen Prochnow, Herbert Grönemeyer, Klaus Wennemann, Hubertus Bengsch","Adventure, Drama, Thriller"
0752,Planet Terror,2007,105 min,7.1,,Robert Rodriguez,"Rose McGowan, Freddy Rodríguez, Josh Brolin, Marley Shelton","Action, Comedy, Horror"
0753,P.S. I Love You,2007,126 min,7.1,39,Richard LaGravenese,"Hilary Swank, Gerard Butler, Harry Connick Jr., Lisa Kudrow","Drama, Romance"
0754,Yip Man,2008,106 min,8,59,Wilson Yip,"Donnie Yen, Simon Yam, Siu-Wong Fan, Ka Tung Lam","Action, Biography, Drama"
0755,Spy,2015,119 min,7,75,Paul Feig,"Melissa McCarthy, Rose Byrne, Jude Law, Jason Statham","Action, Comedy, Crime"
0756,Zootopia,2016,108 min,8,78,Byron Howard,"Rich Moore, Jared Bush, Ginnifer Goodwin, Jason Bateman, Idris Elba, Jenny Slate","Animation, Adventure, Comedy"
0757,Romeo + Juliet,1996,120 min,6.8,60,Baz Luhrmann,"Leonardo DiCaprio, Claire Danes, John Leguizamo, Harold Perrineau","Drama, Romance"
0758,Teenage Mutant Ninja Turtles,2014,101 min,5.8,31,Jonathan Liebesman,"Megan Fox, Will Arnett, William Fichtner, Noel Fisher","Action, Adventure, Comedy"
0759,Safe House,2012,115 min,6.8,52,Daniel Espinosa,"Denzel Washington, Ryan Reynolds, Robert Patrick, Vera Farmiga","Action, Adventure, Crime"
0760,Death Race,2008,105 min,6.4,43,Paul W.S. Anderson,"Jason Statham, Joan Allen, Tyrese Gibson, Ian McShane","Action, Sci-Fi, Thriller"
0761,Ice Age: Dawn of the Dinosaurs,2009,94 min,7,50,Carlos Saldanha,"Mike Thurmeier, Ray Romano, John Leguizamo, Denis Leary, Eunice Cho","Animation, Action, Adventure"
0762,"I Love You, Man",2009,105 min,7,70,John Hamburg,"Paul Rudd, Jason Segel, Rashida Jones, Sarah Burns","Comedy, Romance"
0763,Match Point,2005,124 min,7.6,72,Woody Allen,"Scarlett Johansson, Jonathan Rhys Meyers, Emily Mortimer, Matthew Goode","Drama, Romance, Thriller"
0764,Machete,2010,105 min,6.6,60,Ethan Maniquis,"Robert Rodriguez, Danny Trejo, Michelle Rodriguez, Robert De Niro, Jessica Alba","Action, Crime, Thriller"
0765,A Good Day to Die Hard,2013,98 min,5.3,28,John Moore,"Bruce Willis, Jai Courtney, Sebastian Koch, Mary Elizabeth Winstead","Action, Thriller"
0766,The Great Escape,1963,172 min,8.2,87,John Sturges,"Steve McQueen, James Garner, Richard Attenborough, Charles Bronson","Adventure, Drama, History"
0767,Predestination,2014,97 min,7.5,69,Michael Spierig,"Peter Spierig, Ethan Hawke, Sarah Snook, Noah Taylor, Madeleine West","Drama, Mystery, Sci-Fi"
0768,Rio,2011,96 min,6.9,63,Carlos Saldanha,"Jesse Eisenberg, Anne Hathaway, George Lopez, Karen Disher","Animation, Adventure, Comedy"
0769,The Number 23,2007,98 min,6.4,,Joel Schumacher,"Jim Carrey, Virginia Madsen, Logan Lerman, Danny Huston","Crime, Mystery, Thriller"
0770,The Hunger Games: Mockingjay - Part 2,2015,137 min,6.6,65,Francis Lawrence,"Jennifer Lawrence, Josh Hutcherson, Liam Hemsworth, Woody Harrelson","Action, Adventure, Sci-Fi"
0771,White House Down,2013,131 min,6.4,52,Roland Emmerich,"Channing Tatum, Jamie Foxx, Maggie Gyllenhaal, Jason Clarke","Action, Drama, Thriller"
0772,Hotel Transylvania,2012,91 min,7.1,47,Genndy Tartakovsky,"Adam Sandler, Kevin James, Andy Samberg, Selena Gomez","Animation, Comedy, Family"
0773,The Ugly Truth,2009,96 min,6.5,28,Robert Luketic,"Katherine Heigl, Gerard Butler, Bree Turner, Eric Winter","Comedy, Romance"
0774,True Romance,1993,119 min,7.9,59,Tony Scott,"Christian Slater, Patricia Arquette, Dennis Hopper, Val Kilmer","Crime, Drama, Romance"
0775,The Happening,2008,91 min,5,34,M. Night Shyamalan,"Mark Wahlberg, Zooey Deschanel, John Leguizamo, Ashlyn Sanchez","Mystery, Sci-Fi, Thriller"
0776,Austin Powers in Goldmember,2002,94 min,6.2,62,Jay Roach,"Mike Myers, Beyoncé, Seth Green, Michael York","Action, Adventure, Comedy"
0777,Carlito's Way,1993,144 min,7.9,65,Brian De Palma,"Al Pacino, Sean Penn, Penelope Ann Miller, John Leguizamo","Crime, Drama, Thriller"
0778,A Walk to Remember,2002,101 min,7.4,35,Adam Shankman,"Mandy Moore, Shane West, Peter Coyote, Daryl Hannah","Drama, Romance"
0779,American Wedding,2003,96 min,6.3,43,Jesse Dylan,"Jason Biggs, Alyson Hannigan, Seann William Scott, Eugene Levy",Comedy
0780,EuroTrip,2004,92 min,6.6,45,Jeff Schaffer,"Alec Berg, David Mandel, Scott Mechlowicz, Jacob Pitts, Michelle Trachtenberg, Travis Wester","Adventure, Comedy"
0781,Rocky Balboa,2006,102 min,7.2,63,Sylvester Stallone,"Sylvester Stallone, Antonio Tarver, Milo Ventimiglia, Burt Young","Drama, Sport"
0782,"South Park: Bigger, Longer & Uncut",1999,81 min,7.8,73,Trey Parker,"Trey Parker, Matt Stone, Mary Kay Bergman, Isaac Hayes","Animation, Comedy, Fantasy"
0783,The Elephant Man,1980,124 min,8.2,77,David Lynch,"Anthony Hopkins, John Hurt, Anne Bancroft, John Gielgud","Biography, Drama"
0784,Big Daddy,1999,93 min,6.4,41,Dennis Dugan,"Adam Sandler, Joey Lauren Adams, Jon Stewart, Cole Sprouse","Comedy, Drama"
0785,Run Lola Run,1998,80 min,7.7,77,Tom Tykwer,"Franka Potente, Moritz Bleibtreu, Herbert Knaup, Nina Petri","Crime, Drama, Thriller"
0786,Napoleon Dynamite,2004,96 min,6.9,64,Jared Hess,"Jon Heder, Efren Ramirez, Jon Gries, Aaron Ruell",Comedy
0787,Pain & Gain,2013,129 min,6.4,45,Michael Bay,"Mark Wahlberg, Dwayne Johnson, Anthony Mackie, Tony Shalhoub","Action, Comedy, Crime"
0788,Remember the Titans,2000,113 min,7.8,48,Boaz Yakin,"Denzel Washington, Will Patton, Wood Harris, Ryan Hurst","Biography, Drama, Sport"
0789,Bad Teacher,2011,92 min,5.7,47,Jake Kasdan,"Cameron Diaz, Jason Segel, Justin Timberlake, Lucy Punch","Comedy, Romance"
0790,Rush Hour 2,2001,90 min,6.6,48,Brett Ratner,"Jackie Chan, Chris Tucker, John Lone, Ziyi Zhang","Action, Comedy, Crime"
0791,Cube,1997,90 min,7.3,61,Vincenzo Natali,"Nicole de Boer, Maurice Dean Wint, David Hewlett, Andrew Miller","Drama, Mystery, Sci-Fi"
0792,Ace Ventura: When Nature Calls,1995,90 min,6.4,45,Steve Oedekerk,"Jim Carrey, Ian McNeice, Simon Callow, Maynard Eziashi","Adventure, Comedy, Crime"
0793,Airplane!,1980,88 min,7.8,78,Jim Abrahams,"David Zucker, Jerry Zucker, Robert Hays, Julie Hagerty, Leslie Nielsen, Kareem Abdul-Jabbar",Comedy
0794,Ben-Hur,1959,212 min,8.1,90,William Wyler,"Charlton Heston, Jack Hawkins, Stephen Boyd, Haya Harareet","Adventure, Drama, History"
0795,The Internship,2013,119 min,6.3,42,Shawn Levy,"Vince Vaughn, Owen Wilson, Rose Byrne, Aasif Mandvi",Comedy
0796,Hansel & Gretel: Witch Hunters,2013,88 min,6.1,23,Tommy Wirkola,"Jeremy Renner, Gemma Arterton, Peter Stormare, Famke Janssen","Action, Fantasy, Horror"
0797,Hanna,2011,111 min,6.8,65,Joe Wright,"Saoirse Ronan, Cate Blanchett, Eric Bana, Vicky Krieps","Action, Drama, Thriller"
0798,What Women Want,2000,127 min,6.4,47,Nancy Meyers,"Mel Gibson, Helen Hunt, Marisa Tomei, Alan Alda","Comedy, Fantasy, Romance"
0799,After Earth,2013,100 min,4.8,33,M. Night Shyamalan,"Jaden Smith, David Denman, Will Smith, Sophie Okonedo","Action, Adventure, Sci-Fi"
0800,Drag Me to Hell,2009,99 min,6.6,83,Sam Raimi,"Alison Lohman, Justin Long, Ruth Livier, Lorna Raver","Horror, Thriller"
0801,Blade II,2002,117 min,6.7,52,Guillermo del Toro,"Wesley Snipes, Kris Kristofferson, Ron Perlman, Leonor Varela","Action, Horror, Sci-Fi"
0802,Room,2015,118 min,8.2,86,Lenny Abrahamson,"Brie Larson, Jacob Tremblay, Sean Bridgers, Wendy Crewson","Drama, Thriller"
0803,Halloween,1978,91 min,7.8,81,John Carpenter,"Donald Pleasence, Jamie Lee Curtis, Tony Moran, Nancy Kyes","Horror, Thriller"
0804,The World Is Not Enough,1999,128 min,6.4,57,Michael Apted,"Pierce Brosnan, Sophie Marceau, Robert Carlyle, Denise Richards","Action, Adventure, Thriller"
0805,For a Few Dollars More,1965,132 min,8.3,74,Sergio Leone,"Clint Eastwood, Lee Van Cleef, Gian Maria Volontè, Mario Brega",Western
0806,Project X,2012,88 min,6.7,48,Nima Nourizadeh,"Thomas Mann, Oliver Cooper, Jonathan Daniel Brown, Dax Flame",Comedy
0807,Lara Croft: Tomb Raider,2001,100 min,5.8,33,Simon West,"Angelina Jolie, Jon Voight, Iain Glen, Noah Taylor","Action, Adventure, Fantasy"
0808,Dark City,1998,100 min,7.7,66,Alex Proyas,"Rufus Sewell, Kiefer Sutherland, Jennifer Connelly, William Hurt","Mystery, Sci-Fi, Thriller"
0809,2 Guns,2013,109 min,6.7,55,Baltasar Kormákur,"Denzel Washington, Mark Wahlberg, Paula Patton, Bill Paxton","Action, Comedy, Crime"
0810,A Series of Unfortunate Events,2004,108 min,6.8,62,Brad Silberling,"Jim Carrey, Jude Law, Meryl Streep, Liam Aiken","Adventure, Comedy, Family"
0811,How to Lose a Guy in 10 Days,2003,116 min,6.4,45,Donald Petrie,"Kate Hudson, Matthew McConaughey, Adam Goldberg, Kathryn Hahn","Comedy, Romance"
0812,You Don't Mess with the Zohan,2008,113 min,5.5,54,Dennis Dugan,"Adam Sandler, John Turturro, Emmanuelle Chriqui, Nick Swardson",Comedy
0813,Underworld: Evolution,2006,106 min,6.7,36,Len Wiseman,"Kate Beckinsale, Scott Speedman, Bill Nighy, Tony Curran","Action, Adventure, Fantasy"
0814,Transporter 2,2005,87 min,6.3,56,Louis Leterrier,"Jason Statham, Amber Valletta, Kate Nauta, Alessandro Gassman","Action, Crime, Thriller"
0815,Happy Gilmore,1996,92 min,7,31,Dennis Dugan,"Adam Sandler, Christopher McDonald, Julie Bowen, Frances Bay","Comedy, Sport"
0816,The Hitchhiker's Guide to the Galaxy,2005,109 min,6.8,63,Garth Jennings,"Martin Freeman, Yasiin Bey, Sam Rockwell, Zooey Deschanel","Adventure, Comedy, Sci-Fi"
0817,Swordfish,2001,99 min,6.5,32,Dominic Sena,"John Travolta, Hugh Jackman, Halle Berry, Don Cheadle","Action, Crime, Thriller"
0818,Grindhouse,2007,191 min,7.6,77,Robert Rodriguez,"Eli Roth, Quentin Tarantino, Edgar Wright, Rob Zombie, Kurt Russell, Rose McGowan, Danny Trejo, Zoë Bell","Action, Horror, Thriller"
0819,Harold & Kumar Go to White Castle,2004,88 min,7.1,64,Danny Leiner,"John Cho, Kal Penn, Ethan Embry, Rob Tinkler","Adventure, Comedy"
0820,Battle Los Angeles,2011,116 min,5.8,37,Jonathan Liebesman,"Aaron Eckhart, Michelle Rodriguez, Bridget Moynahan, Ramon Rodriguez","Action, Sci-Fi"
0821,The Descent,2005,99 min,7.2,71,Neil Marshall,"Shauna Macdonald, Natalie Mendoza, Alex Reid, Saskia Mulder","Adventure, Horror, Thriller"
0822,Sinister,2012,110 min,6.8,53,Scott Derrickson,"Ethan Hawke, Juliet Rylance, James Ransone, Fred Dalton Thompson","Horror, Mystery, Thriller"
0823,Hachi: A Dog's Tale,2009,93 min,8.1,,Lasse Hallström,"Richard Gere, Joan Allen, Cary-Hiroyuki Tagawa, Sarah Roemer","Drama, Family"
0824,Sleepers,1996,147 min,7.6,49,Barry Levinson,"Robert De Niro, Kevin Bacon, Brad Pitt, Jason Patric","Crime, Drama, Thriller"
0825,Ghost,1990,127 min,7,52,Jerry Zucker,"Patrick Swayze, Demi Moore, Whoopi Goldberg, Tony Goldwyn","Drama, Fantasy, Romance"
0826,Insurgent,2015,119 min,6.2,42,Robert Schwentke,"Shailene Woodley, Ansel Elgort, Theo James, Kate Winslet","Action, Adventure, Sci-Fi"
0827,Big,1988,104 min,7.3,73,Penny Marshall,"Tom Hanks, Elizabeth Perkins, Robert Loggia, John Heard","Comedy, Drama, Family"
0828,Wrath of the Titans,2012,99 min,5.7,37,Jonathan Liebesman,"Sam Worthington, Liam Neeson, Rosamund Pike, Ralph Fiennes","Action, Adventure, Fantasy"
0829,Revolutionary Road,2008,119 min,7.3,69,Sam Mendes,"Leonardo DiCaprio, Kate Winslet, Christopher Fitzgerald, Jonathan Roumie","Drama, Romance"
0830,Cloudy with a Chance of Meatballs,2009,90 min,7,66,Phil Lord,"Christopher Miller, Anna Faris, Bill Hader, Bruce Campbell, James Caan","Animation, Action, Adventure"
0831,The Bank Job,2008,111 min,7.2,69,Roger Donaldson,"Jason Statham, Saffron Burrows, Stephen Campbell Moore, Daniel Mays","Crime, Thriller"
0832,Brazil,1985,132 min,8,88,Terry Gilliam,"Jonathan Pryce, Kim Greist, Robert De Niro, Katherine Helmond","Drama, Sci-Fi"
0833,Cinema Paradiso,1988,155 min,8.5,80,Giuseppe Tornatore,"Philippe Noiret, Enzo Cannavale, Antonella Attili, Isa Danieli",Drama
0834,Mad Max,1979,88 min,7,73,George Miller,"Mel Gibson, Joanne Samuel, Hugh Keays-Byrne, Steve Bisley","Action, Adventure, Sci-Fi"
0835,Butch Cassidy and the Sundance Kid,1969,110 min,8.1,66,George Roy Hill,"Paul Newman, Robert Redford, Katharine Ross, Strother Martin","Biography, Crime, Drama"
0836,You've Got Mail,1998,119 min,6.6,57,Nora Ephron,"Tom Hanks, Meg Ryan, Greg Kinnear, Parker Posey","Comedy, Drama, Romance"
0837,Godzilla,1998,139 min,5.3,32,Roland Emmerich,"Matthew Broderick, Jean Reno, Maria Pitillo, Hank Azaria","Action, Sci-Fi, Thriller"
0838,A Separation,2011,123 min,8.3,95,Asghar Farhadi,"Payman Maadi, Leila Hatami, Sareh Bayat, Shahab Hosseini","Drama, Thriller"
0839,Surrogates,2009,89 min,6.3,45,Jonathan Mostow,"Bruce Willis, Radha Mitchell, Ving Rhames, Rosamund Pike","Action, Sci-Fi, Thriller"
0840,Resident Evil: Apocalypse,2004,94 min,6.2,35,Alexander Witt,"Milla Jovovich, Sienna Guillory, Eric Mabius, Oded Fehr","Action, Horror, Sci-Fi"
0841,Eagle Eye,2008,118 min,6.6,43,D.J. Caruso,"Shia LaBeouf, Michelle Monaghan, Rosario Dawson, Michael Chiklis","Action, Mystery, Thriller"
0842,The Croods,2013,98 min,7.2,55,Kirk DeMicco,"Chris Sanders, Nicolas Cage, Ryan Reynolds, Emma Stone, Catherine Keener","Animation, Action, Adventure"
0843,Chocolat,2000,121 min,7.3,64,Lasse Hallström,"Juliette Binoche, Judi Dench, Alfred Molina, Carrie-Anne Moss","Drama, Romance"
0844,Sideways,2004,127 min,7.5,94,Alexander Payne,"Paul Giamatti, Thomas Haden Church, Virginia Madsen, Sandra Oh","Comedy, Drama, Romance"
0845,The Taking of Pelham 123,2009,106 min,6.4,55,Tony Scott,"Denzel Washington, John Travolta, Luis Guzmán, Victor Gojcaj","Action, Crime, Thriller"
0846,Blue Jasmine,2013,98 min,7.3,78,Woody Allen,"Cate Blanchett, Alec Baldwin, Peter Sarsgaard, Sally Hawkins",Drama
0847,Unstoppable,2010,98 min,6.8,69,Tony Scott,"Denzel Washington, Chris Pine, Rosario Dawson, Ethan Suplee","Action, Thriller"
0848,Singin' in the Rain,1952,103 min,8.3,99,Stanley Donen,"Gene Kelly, Gene Kelly, Donald O'Connor, Debbie Reynolds, Jean Hagen","Comedy, Musical, Romance"
0849,The Chronicles of Narnia: Prince Caspian,2008,150 min,6.5,62,Andrew Adamson,"Ben Barnes, Skandar Keynes, Georgie Henley, William Moseley","Action, Adventure, Family"
0850,Zack and Miri Make a Porno,2008,101 min,6.6,56,Kevin Smith,"Seth Rogen, Elizabeth Banks, Craig Robinson, Gerry Bednob","Comedy, Romance"
0851,Tomorrow Never Dies,1997,119 min,6.5,52,Roger Spottiswoode,"Pierce Brosnan, Jonathan Pryce, Michelle Yeoh, Teri Hatcher","Action, Adventure, Thriller"
0852,25th Hour,2002,135 min,7.7,67,Spike Lee,"Edward Norton, Barry Pepper, Philip Seymour Hoffman, Rosario Dawson",Drama
0853,Ying xiong,2002,107 min,7.9,85,Yimou Zhang,"Jet Li, Tony Chiu-Wai Leung, Maggie Cheung, Ziyi Zhang","Action, Adventure, History"
0854,Resident Evil: Extinction,2007,94 min,6.3,41,Russell Mulcahy,"Milla Jovovich, Ali Larter, Oded Fehr, Iain Glen","Action, Horror, Sci-Fi"
0855,The Bridge on the River Kwai,1957,161 min,8.2,87,David Lean,"William Holden, Alec Guinness, Jack Hawkins, Sessue Hayakawa","Adventure, Drama, War"
0856,Cruel Intentions,1999,97 min,6.8,56,Roger Kumble,"Sarah Michelle Gellar, Ryan Phillippe, Reese Witherspoon, Selma Blair","Drama, Romance"
0857,A Nightmare on Elm Street,1984,91 min,7.5,76,Wes Craven,"Heather Langenkamp, Johnny Depp, Robert Englund, John Saxon",Horror
0858,The Golden Compass,2007,113 min,6.1,51,Chris Weitz,"Nicole Kidman, Daniel Craig, Dakota Blue Richards, Ben Walker","Adventure, Family, Fantasy"
0859,When Harry Met Sally...,1989,95 min,7.6,76,Rob Reiner,"Billy Crystal, Meg Ryan, Carrie Fisher, Bruno Kirby","Comedy, Drama, Romance"
0860,Stargate,1994,116 min,7.1,42,Roland Emmerich,"Kurt Russell, James Spader, Jaye Davidson, Viveca Lindfors","Action, Adventure, Sci-Fi"
0861,Tinker Tailor Soldier Spy,2011,122 min,7.1,85,Tomas Alfredson,"Gary Oldman, Colin Firth, Tom Hardy, Mark Strong","Drama, Mystery, Thriller"
0862,K-PAX,2001,120 min,7.4,49,Iain Softley,"Kevin Spacey, Jeff Bridges, Mary McCormack, Alfre Woodard","Drama, Sci-Fi"
0863,Focus,2015,105 min,6.6,56,Glenn Ficarra,"John Requa, Will Smith, Margot Robbie, Rodrigo Santoro, Adrian Martinez","Comedy, Crime, Drama"
0864,Side Effects,2013,106 min,7.1,75,Steven Soderbergh,"Rooney Mara, Channing Tatum, Jude Law, Catherine Zeta-Jones","Crime, Drama, Mystery"
0865,Cinderella Man,2005,144 min,8,69,Ron Howard,"Russell Crowe, Renée Zellweger, Craig Bierko, Paul Giamatti","Biography, Drama, Sport"
0866,Knight and Day,2010,109 min,6.3,46,James Mangold,"Tom Cruise, Cameron Diaz, Peter Sarsgaard, Jordi Mollà","Action, Adventure, Comedy"
0867,The Sound of Music,1965,172 min,8,63,Robert Wise,"Julie Andrews, Christopher Plummer, Eleanor Parker, Richard Haydn","Biography, Drama, Family"
0868,The Raid: Redemption,2011,101 min,7.6,73,Gareth Evans,"Iko Uwais, Ananda George, Ray Sahetapy, Donny Alamsyah","Action, Thriller"
0869,Mr. Nobody,2009,141 min,7.8,63,Jaco Van Dormael,"Jared Leto, Sarah Polley, Diane Kruger, Linh Dan Pham","Drama, Fantasy, Romance"
0870,Elf,2003,97 min,6.9,64,Jon Favreau,"Will Ferrell, James Caan, Bob Newhart, Zooey Deschanel","Comedy, Family, Fantasy"
0871,This Means War,2012,103 min,6.3,31,McG,"Reese Witherspoon, Chris Pine, Tom Hardy, Til Schweiger","Action, Comedy, Romance"
0872,Secret Window,2004,96 min,6.6,46,David Koepp,"Johnny Depp, Maria Bello, John Turturro, Timothy Hutton","Drama, Mystery, Thriller"
0873,Get Him to the Greek,2010,109 min,6.4,65,Nicholas Stoller,"Jonah Hill, Russell Brand, Elisabeth Moss, Rose Byrne","Adventure, Comedy, Music"
0874,A Fistful of Dollars,1964,99 min,8,65,Sergio Leone,"Clint Eastwood, Gian Maria Volontè, Marianne Koch, Wolfgang Lukschy",Western
0875,San Andreas,2015,114 min,6.1,43,Brad Peyton,"Dwayne Johnson, Carla Gugino, Alexandra Daddario, Colton Haynes","Action, Adventure, Drama"
0876,17 Again,2009,102 min,6.4,48,Burr Steers,"Zac Efron, Matthew Perry, Leslie Mann, Thomas Lennon","Comedy, Drama, Fantasy"
0877,Bolt,2008,96 min,6.9,67,Byron Howard,"Chris Williams, John Travolta, Miley Cyrus, Susie Essman, Mark Walton","Animation, Adventure, Comedy"
0878,G.I. Joe: Retaliation,2013,110 min,5.8,41,Jon M. Chu,"Dwayne Johnson, Channing Tatum, Adrianne Palicki, Byung-Hun Lee","Action, Adventure, Sci-Fi"
0879,The Next Three Days,2010,133 min,7.4,52,Paul Haggis,"Russell Crowe, Elizabeth Banks, Liam Neeson, Michael Buie","Action, Crime, Drama"
0880,Southpaw,2015,124 min,7.4,57,Antoine Fuqua,"Jake Gyllenhaal, Rachel McAdams, Oona Laurence, Forest Whitaker","Drama, Sport"
0881,Air Force One,1997,124 min,6.5,61,Wolfgang Petersen,"Harrison Ford, Gary Oldman, Glenn Close, Wendy Crewson","Action, Drama, Thriller"
0882,Mamma Mia!,2008,108 min,6.4,51,Phyllida Lloyd,"Meryl Streep, Pierce Brosnan, Amanda Seyfried, Stellan Skarsgård","Comedy, Musical, Romance"
0883,Madagascar: Escape 2 Africa,2008,89 min,6.7,61,Eric Darnell,"Tom McGrath, Ben Stiller, Chris Rock, David Schwimmer, Jada Pinkett Smith","Animation, Adventure, Comedy"
0884,The Vow,2012,104 min,6.8,43,Michael Sucsy,"Rachel McAdams, Channing Tatum, Sam Neill, Jessica Lange","Drama, Romance"
0885,The Last King of Scotland,2006,123 min,7.7,74,Kevin Macdonald,"James McAvoy, Forest Whitaker, Gillian Anderson, Kerry Washington","Biography, Drama, History"
0886,Ronin,1998,122 min,7.3,67,John Frankenheimer,"Robert De Niro, Jean Reno, Natascha McElhone, Stellan Skarsgård","Action, Adventure, Crime"
0887,Charlie's Angels,2000,98 min,5.5,52,McG,"Cameron Diaz, Drew Barrymore, Lucy Liu, Bill Murray","Action, Adventure, Comedy"
0888,Creed,2015,133 min,7.6,82,Ryan Coogler,"Michael B. Jordan, Sylvester Stallone, Tessa Thompson, Phylicia Rashad","Drama, Sport"
0889,Robin Hood: Prince of Thieves,1991,143 min,6.9,51,Kevin Reynolds,"Kevin Costner, Morgan Freeman, Mary Elizabeth Mastrantonio, Christian Slater","Action, Adventure, Drama"
0890,Shame,2011,101 min,7.2,72,Steve McQueen,"Michael Fassbender, Carey Mulligan, James Badge Dale, Lucy Walters",Drama
0891,The Impossible,2012,114 min,7.6,73,J.A. Bayona,"Naomi Watts, Ewan McGregor, Tom Holland, Oaklee Pendergast","Drama, History, Thriller"
0892,Ice Age: Continental Drift,2012,88 min,6.6,49,Steve Martino,"Mike Thurmeier, Ray Romano, Denis Leary, John Leguizamo, Aziz Ansari","Animation, Adventure, Comedy"
0893,Waterworld,1995,135 min,6.2,56,Kevin Reynolds,"Kevin Costner, Jeanne Tripplehorn, Dennis Hopper, Tina Majorino","Action, Adventure, Sci-Fi"
0894,Twister,1996,113 min,6.3,68,Jan de Bont,"Helen Hunt, Bill Paxton, Cary Elwes, Jami Gertz","Action, Adventure, Drama"
0895,About a Boy,2002,101 min,7.1,75,Chris Weitz,"Paul Weitz, Hugh Grant, Nicholas Hoult, Toni Collette, Sharon Small","Comedy, Drama, Romance"
0896,Tarzan,1999,88 min,7.3,79,Chris Buck,"Kevin Lima, Tony Goldwyn, Minnie Driver, Brian Blessed, Glenn Close","Animation, Adventure, Family"
0897,Dracula,1992,128 min,7.5,57,Francis Ford Coppola,"Gary Oldman, Winona Ryder, Anthony Hopkins, Keanu Reeves",Horror
0898,The Hunt for Red October,1990,135 min,7.6,58,John McTiernan,"Sean Connery, Alec Baldwin, Scott Glenn, Sam Neill","Action, Adventure, Thriller"
0899,AVP: Alien vs. Predator,2004,101 min,5.6,29,Paul W.S. Anderson,"Sanaa Lathan, Lance Henriksen, Raoul Bova, Ewen Bremner","Action, Adventure, Horror"
0900,Jarhead,2005,125 min,7,58,Sam Mendes,"Jake Gyllenhaal, Jamie Foxx, Lucas Black, Scott MacDonald","Biography, Drama, War"
0901,Love & Other Drugs,2010,112 min,6.7,55,Edward Zwick,"Jake Gyllenhaal, Anne Hathaway, Judy Greer, Oliver Platt","Comedy, Drama, Romance"
0902,Adaptation.,2002,115 min,7.7,83,Spike Jonze,"Nicolas Cage, Meryl Streep, Chris Cooper, Tilda Swinton","Comedy, Drama"
0903,High Fidelity,2000,113 min,7.5,79,Stephen Frears,"John Cusack, Iben Hjejle, Todd Louiso, Jack Black","Comedy, Drama, Music"
0904,Coraline,2009,100 min,7.7,80,Henry Selick,"Dakota Fanning, Teri Hatcher, John Hodgman, Jennifer Saunders","Animation, Drama, Fantasy"
0905,Modern Times,1936,87 min,8.5,96,Charles Chaplin,"Charles Chaplin, Paulette Goddard, Henry Bergman, Tiny Sandford","Comedy, Drama, Family"
0906,X-Men: Apocalypse,2016,144 min,7,52,Bryan Singer,"James McAvoy, Michael Fassbender, Jennifer Lawrence, Nicholas Hoult","Action, Adventure, Sci-Fi"
0907,Pi,1998,84 min,7.4,72,Darren Aronofsky,"Sean Gullette, Mark Margolis, Ben Shenkman, Pamela Hart","Drama, Horror, Mystery"
0908,xXx,2002,124 min,5.9,48,Rob Cohen,"Vin Diesel, Asia Argento, Marton Csokas, Samuel L. Jackson","Action, Adventure, Thriller"
0909,Beowulf,2007,115 min,6.2,59,Robert Zemeckis,"Ray Winstone, Crispin Glover, Angelina Jolie, Robin Wright","Animation, Action, Adventure"
